
<?xml version="1.0" encoding="UTF-8"?>

<!ELEMENT employees (employee+)>
<!ELEMENT employee (id, name, address)>
<!ELEMENT id (#PCDATA)>
<!ELEMENT name (#PCDATA)>
<!ELEMENT address (#PCDATA)>
